{
  "schema_version": "1.1",
  "cycle_id": "2026-08-30__evolution-canonical-cycle",
  "period_start": "2026-08-30T00:00:00Z",
  "period_end": "2026-08-31T00:00:00Z",
  "evidence_cutoff": "2026-08-31T00:25:00Z",
  "repository": "POLYPROPICKS/PREMVP",
  "generated_by": {
    "executor": "claude_code_cloud",
    "model_label": "Claude Sonnet 5 (Claude Code CLI), running as the claude_code_cloud execution target per CAPABILITY_MATRIX.yaml, invoked by a scheduled Routine (Routine A)",
    "prompt_id": "premvp.prompt.daily_evolution_review.v1"
  },
  "inputs": {
    "completion_envelope_ids": [],
    "confirmed_changes": [],
    "input_bundle_ref": "docs/ai-context/control-plane/evolution/input-bundles/2026-08-30__evolution-canonical-cycle.json"
  },
  "axis_a": {
    "verdict": "NOT_ENOUGH_EVIDENCE",
    "what_moved": [],
    "next_verified_production_fact_now_possible": null,
    "blockers_removed": [],
    "blockers_introduced": [],
    "not_proven": [
      "Zero PRs merged to origin/main since the prior cycle's evidence_cutoff (2026-08-30T00:30:00Z) through this cycle's evidence_cutoff (2026-08-31T00:25:00Z) — the only ancestry event in that window is the merge of the prior cycle's own docs artifact (PR#211, 2026-08-30T00:33:32Z), which is this cycle's predecessor, not new evidence.",
      "docs/ai-context/control-plane/CURRENT_STATE.yaml is unchanged since 2026-08-28T21:00:54Z (state_version 17) — still the same ~7-merge staleness gap recorded last cycle (DEF-2026-08-28-CURRENT-STATE-EVIDENCE-LEDGER-STALE / hypothesis H1), neither worsened nor re-verified this period because no new merges occurred to re-check against.",
      "CHAIN-PRIMARY-CAP-20260827 and CHAIN-RESERVATION-LOOKBACK-20260828 remain open onion chains with no new links and no new production observation this period (see hypotheses H5, H6 continuity).",
      "No completion envelope was accepted this period."
    ],
    "runtime_or_business_evidence_exists": false,
    "pnl": {
      "reconciled_claimed": false,
      "evidence_kinds": [],
      "evidence_refs": []
    }
  },
  "axis_b": {
    "verdict": "CAPABILITY_STRENGTHENED",
    "capabilities": [
      {
        "domain": "RECOVERY_AND_CHECKPOINTS",
        "statement": "Terminal Evolution-cycle persistence got its first real confirmation: PR#211 went creation-to-merge in 9s, vs a ~35h prior baseline. Closes H7. gh CLI is absent here; the merge used GitHub MCP tools as the environment substitute for github_pr_create.v1/merge.v1.",
        "persisted_artifact": "scripts/control-plane/evolution-canonicalize.mjs",
        "use_or_validation_evidence": "PR#211: real production create-to-merge in 9 seconds, zero Founder action, admission constraints intact.",
        "evidence_refs": [
          "POLYPROPICKS/PREMVP#211",
          "docs/ai-context/control-plane/evolution/cycles/2026-08-28__evolution-canonical-cycle.json#automation_hypotheses.H7",
          "scripts/control-plane/evolution-canonicalize.mjs"
        ]
      }
    ],
    "not_proven": [
      "The GitHub-MCP-tool fallback is confirmed only for a docs-only, schema-gated Evolution-cycle artifact (R0_READ_ONLY). It has not yet been exercised for an Automation Roadmap Governor result or any product-code lineage, and gh CLI itself remains unavailable in this environment — this is a routed-around gap, not a fixed one.",
      "CURRENT_STATE.yaml reconciliation (H1) still runs only as a one-off manual action, not on a schedule or as a CI gate — unchanged from last cycle, no new evidence either way this period.",
      "operator_action_events capture is still a lower bound with no primary per-message log (H4) — unchanged from last cycle."
    ]
  },
  "supporting_metrics": {
    "role": "DIAGNOSTIC_ONLY",
    "values": {
      "time_to_verified_result": "UNKNOWN",
      "first_pass_pass_rate": "UNKNOWN",
      "rework_count": "UNKNOWN",
      "cost_per_verified_result": "UNKNOWN",
      "reviewer_rejection_count": "UNKNOWN",
      "runtime_evidence_count": 0,
      "reusable_artifacts_created": 0,
      "cloudcode_actions": 0,
      "codex_actions": 0,
      "architect_corrections": 0,
      "intermediate_actions_per_mission": "UNKNOWN",
      "actions_per_verified_result": "UNKNOWN"
    }
  },
  "operator_actions": {
    "schema_version": "1.0",
    "period_start": "2026-08-30T00:00:00Z",
    "period_end": "2026-08-31T00:00:00Z",
    "capture_coverage": "PARTIAL",
    "total_operator_actions": 0,
    "by_type": {
      "START": 0,
      "FOLLOW_UP": 0,
      "CORRECTION": 0,
      "RETRY": 0,
      "HANDOFF": 0,
      "APPROVAL": 0
    },
    "by_surface": {
      "CLOUDCODE": 0,
      "CODEX": 0,
      "UNKNOWN": 0
    },
    "architect_corrections": 0,
    "duplicates_dropped": 0,
    "excluded": [],
    "derived": {
      "intermediate_actions_per_mission": "UNKNOWN",
      "actions_per_verified_result": "UNKNOWN"
    }
  },
  "operating_telemetry": {
    "founder_actions_removable": "UNKNOWN",
    "executor_runs": "UNKNOWN",
    "successful_terminal_results": "UNKNOWN",
    "reruns_resumes": "UNKNOWN",
    "recovery_iterations": "UNKNOWN",
    "reviewer_corrections_rejections": 0,
    "orchestration_waste_iterations": "UNKNOWN",
    "implemented_fixes": 0,
    "proven_effective_fixes": 0,
    "runtime_evidence_count": 0,
    "reusable_artifacts_created": 0,
    "actions_per_verified_result": "UNKNOWN",
    "time_to_verified_result": "UNKNOWN",
    "capture_coverage": "PARTIAL",
    "chat_interaction_coverage": "PARTIAL",
    "founder_actions_proven": 0,
    "architect_corrections": 0,
    "defect_occurrences": [
      {
        "defect_id": "DEF-2026-08-30-GOVERNOR-ARTIFACT-DRAFT-PR-ACCUMULATION",
        "origin": "ORCHESTRATION_OR_RECOVERY_DEFECT",
        "recurrence": "SAME_ROOT_REPEAT",
        "defect_chain_id": null,
        "implemented_fix_ref": null,
        "proven_effective_evidence_refs": []
      }
    ],
    "defect_counts_by_origin": {
      "ORCHESTRATION_OR_RECOVERY_DEFECT": 1
    },
    "defect_counts_by_recurrence": {
      "SAME_ROOT_REPEAT": 1
    },
    "repeated_defect_families": 0,
    "active_onion_chains": 0
  },
  "automation_hypotheses": [
    {
      "id": "H1",
      "observed_problem": "CURRENT_STATE.yaml still shows updated_at=2026-08-28T21:00:54Z (state_version 17) with no new reconciliation this period — the same ~7-merge staleness gap from last cycle, unchanged because no new merges happened to re-check it against, but also because no scheduled or gated reconciliation runs on its own.",
      "why_it_matters": "Third consecutive cycle carrying the same open gap: a reconciliation library has existed for days (PR#185) but has only ever run manually, once.",
      "axis_a_effect": "Indirect: any Architect planning session run before this is fixed still risks planning on top of a state picture that can silently drift again.",
      "axis_b_effect": "none — the capability already exists, the gap is purely in scheduling/automation, not implementation",
      "proposed_automation": "Unchanged from last two cycles: wire scripts/control-plane/lib/control-plane-reconcile.mjs as a CI gate or a separate read-only Routine that compares CURRENT_STATE.origin_main_sha against live origin/main on every merge or on a fixed schedule.",
      "persistent_artifact": "scripts/control-plane/lib/control-plane-reconcile.mjs",
      "expected_value": "origin_main_sha in CURRENT_STATE.yaml never drifts more than a small, defined number of merges behind",
      "implementation_cost": "UNKNOWN",
      "verification_cost": "UNKNOWN",
      "risk": "Low in read-only/proposal mode; this review does not accept a CURRENT_STATE delta itself",
      "success_metric": "At the next cycle's evidence_cutoff, origin_main_sha is behind live origin/main by a small defined number of merges, not by 7+",
      "rollback_or_stop_condition": "Stop if reconciliation requires production runtime or database access, or the Founder rejects the proposed delta.",
      "timing": "Next cycle or later",
      "classification": "NOW",
      "evidence_refs": [
        "docs/ai-context/control-plane/CURRENT_STATE.yaml",
        "docs/ai-context/control-plane/evolution/cycles/2026-08-28__evolution-canonical-cycle.json#automation_hypotheses.H1",
        "docs/ai-context/control-plane/evolution/cycles/2026-08-26__evolution-canonical-cycle.json#automation_hypotheses.H1"
      ]
    },
    {
      "id": "H2",
      "observed_problem": "No new instance this period (no new engineering happened at all), but the underlying gap from the last two cycles — no shared population-conservation test helper for the primary feed funnel, despite 5-6 confirmed instances of the same silent-cap pattern across CHAIN-PRIMARY-CAP-20260827 — is still unaddressed.",
      "why_it_matters": "A dormant period does not close an open structural gap; the next engineering period on this funnel is exactly as likely to hit case #7 as before.",
      "axis_a_effect": "None this period (no funnel work happened); each future unfound cap would still silently drop qualified events",
      "axis_b_effect": "Would turn manually repeated diagnosis into a reusable, testable invariant — proposal unchanged since H2 two cycles ago",
      "proposed_automation": "Same shared population-conservation check across funnel stages proposed last cycle, still buildable from the two already-existing test cases (primaryPopulationDecoupling, primaryCoverageDiagnosticOnly) without new product code.",
      "persistent_artifact": "tests/feed/lib/populationConservation.ts (still not created)",
      "expected_value": "One reusable check instead of N one-off ones; faster discovery of the next instance of this pattern",
      "implementation_cost": "UNKNOWN",
      "verification_cost": "UNKNOWN",
      "risk": "Low: test helper only, no product behavior change",
      "success_metric": "A fix on a different funnel stage reuses this helper instead of new one-off check code",